{
  "schemaVersion": 1,
  "id": "studio.demo.neighborhood-pulse",
  "displayName": "Neighborhood Pulse",
  "description": "A licensed development feature used by the built-in Studio project.",
  "version": "1.0.0",
  "publisher": "repository.demo",
  "minimumHostRuntime": "0.1.0",
  "maximumTestedHostRuntime": "0.1.0",
  "supportedPlatforms": ["web", "ios", "android"],
  "entryPoint": "./feature.ts",
  "lifecyclePolicy": { "start": "lazy", "background": "suspend", "failure": "isolate" },
  "killSwitchKey": "studio.demo.neighborhood-pulse.enabled",
  "requiredHostCapabilities": ["animation", "theme"],
  "optionalHostCapabilities": ["analytics"],
  "licenseEntitlement": "studio.demo",
  "dependencies": [],
  "conflicts": [],
  "configurationSchema": {},
  "commands": [],
  "eventsEmitted": [],
  "eventsConsumed": [],
  "uiSurfaces": [{ "id": "studio.demo.neighborhood-pulse.panel", "kind": "panel" }],
  "backgroundServices": [],
  "permissions": [],
  "dataMigrations": [],
  "featureFlags": [],
  "privacy": { "dataCategories": [], "purposes": ["Local development demonstration"], "retentionDays": 0, "sharesExternally": false },
  "resourceRequirements": { "maxMemoryMb": 16, "maxStorageMb": 4, "networkRequired": false },
  "packageChecksum": "0000000000000000000000000000000000000000000000000000000000000000"
}
